{
  "$schema": "http://json-schema.org/draft-07/schema#",
  "type": "object",
  "properties": {
    "id": {
      "type": "string",
      "pattern": "^[0-9a-f]{8}-[0-9a-f]{4}-7[0-9a-f]{3}-[89ab][0-9a-f]{3}-[0-9a-f]{12}$"
    },
    "tenant_id": {
      "type": "string",
      "format": "uuid",
      "pattern": "^([0-9a-fA-F]{8}-[0-9a-fA-F]{4}-[1-8][0-9a-fA-F]{3}-[89abAB][0-9a-fA-F]{3}-[0-9a-fA-F]{12}|00000000-0000-0000-0000-000000000000)$"
    },
    "workspace_id": {
      "type": "string",
      "format": "uuid",
      "pattern": "^([0-9a-fA-F]{8}-[0-9a-fA-F]{4}-[1-8][0-9a-fA-F]{3}-[89abAB][0-9a-fA-F]{3}-[0-9a-fA-F]{12}|00000000-0000-0000-0000-000000000000)$"
    },
    "project_id": {
      "anyOf": [
        {
          "type": "string",
          "format": "uuid",
          "pattern": "^([0-9a-fA-F]{8}-[0-9a-fA-F]{4}-[1-8][0-9a-fA-F]{3}-[89abAB][0-9a-fA-F]{3}-[0-9a-fA-F]{12}|00000000-0000-0000-0000-000000000000)$"
        },
        {
          "type": "null"
        }
      ]
    },
    "work_item_id": {
      "anyOf": [
        {
          "type": "string",
          "minLength": 1
        },
        {
          "type": "null"
        }
      ]
    },
    "run_id": {
      "anyOf": [
        {
          "type": "string",
          "minLength": 1
        },
        {
          "type": "null"
        }
      ]
    },
    "seq": {
      "type": "integer",
      "minimum": 0,
      "maximum": 9007199254740991
    },
    "occurred_at": {
      "type": "string",
      "format": "date-time",
      "pattern": "^(?:(?:\\d\\d[2468][048]|\\d\\d[13579][26]|\\d\\d0[48]|[02468][048]00|[13579][26]00)-02-29|\\d{4}-(?:(?:0[13578]|1[02])-(?:0[1-9]|[12]\\d|3[01])|(?:0[469]|11)-(?:0[1-9]|[12]\\d|30)|(?:02)-(?:0[1-9]|1\\d|2[0-8])))T(?:(?:[01]\\d|2[0-3]):[0-5]\\d(?::[0-5]\\d(?:\\.\\d+)?)?(?:Z))$"
    },
    "origin": {
      "type": "string",
      "enum": [
        "ide",
        "factory",
        "run"
      ]
    },
    "device_id": {
      "anyOf": [
        {
          "type": "string",
          "minLength": 1
        },
        {
          "type": "null"
        }
      ]
    },
    "type": {
      "type": "string",
      "const": "artifact"
    },
    "schema_version": {
      "type": "number",
      "const": 1
    },
    "payload": {
      "anyOf": [
        {
          "type": "object",
          "properties": {
            "kind": {
              "type": "string",
              "minLength": 1
            },
            "name": {
              "type": "string",
              "minLength": 1
            },
            "media_type": {
              "type": "string"
            },
            "body": {
              "type": "string",
              "maxLength": 16384
            }
          },
          "required": [
            "kind",
            "name",
            "body"
          ],
          "additionalProperties": false
        },
        {
          "type": "object",
          "properties": {
            "kind": {
              "type": "string",
              "minLength": 1
            },
            "name": {
              "type": "string",
              "minLength": 1
            },
            "media_type": {
              "type": "string"
            },
            "blob": {
              "type": "object",
              "properties": {
                "sha256": {
                  "type": "string",
                  "pattern": "^[0-9a-f]{64}$"
                },
                "size": {
                  "type": "integer",
                  "minimum": 0,
                  "maximum": 9007199254740991
                }
              },
              "required": [
                "sha256",
                "size"
              ],
              "additionalProperties": false
            }
          },
          "required": [
            "kind",
            "name",
            "blob"
          ],
          "additionalProperties": false
        }
      ]
    }
  },
  "required": [
    "id",
    "tenant_id",
    "workspace_id",
    "project_id",
    "work_item_id",
    "run_id",
    "seq",
    "occurred_at",
    "origin",
    "device_id",
    "type",
    "schema_version",
    "payload"
  ],
  "additionalProperties": false
}
