{
  "id": "0199a1b2-c3d4-7e5f-8a6b-7c8d9e0f1a2b",
  "tenant_id": "11111111-1111-4111-8111-111111111111",
  "workspace_id": "22222222-2222-4222-8222-222222222222",
  "project_id": "33333333-3333-4333-8333-333333333333",
  "work_item_id": "OPT-14",
  "run_id": "run-0001",
  "seq": 1,
  "occurred_at": "2026-10-01T09:00:00.000Z",
  "origin": "factory",
  "device_id": null,
  "type": "artifact",
  "schema_version": 1,
  "payload": {
    "kind": "diff",
    "name": "opt-14.patch",
    "media_type": "text/x-diff",
    "blob": {
      "sha256": "9f86d081884c7d659a2feaa0c55ad015a3bf4f1b2b0b822cd15d6c15b0f00a08",
      "size": 48213
    }
  }
}
